Frame 1: 54 bytes on wire (432 bits), 54 bytes captured (432 bits) on interface 0
Ethernet II, Src: ce:09:ed:74:57:97 (ce:09:ed:74:57:97), Dst: 62:82:d2:70:5e:37 (62:82:d2:70:5e:37)
Internet Protocol Version 4, Src: 10.0.0.2, Dst: 10.0.0.1
Transmission Control Protocol, Src Port: 0 (0), Dst Port: 0 (0), Seq: 1, Len: 0
    Source Port: 0
    Destination Port: 0
    [Stream index: 0]
    [TCP Segment Len: 0]
    Sequence number: 1    (relative sequence number)
    Acknowledgment number: 171181102
        [Expert Info (Note/Protocol): The acknowledgment number field is nonzero while the ACK flag is not set]
            [The acknowledgment number field is nonzero while the ACK flag is not set]
            [Severity level: Note]
            [Group: Protocol]
    Header Length: 20 bytes
    Flags: 0x000 (<None>)
        000. .... .... = Reserved: Not set
        ...0 .... .... = Nonce: Not set
        .... 0... .... = Congestion Window Reduced (CWR): Not set
        .... .0.. .... = ECN-Echo: Not set
        .... ..0. .... = Urgent: Not set
        .... ...0 .... = Acknowledgment: Not set
        .... .... 0... = Push: Not set
        .... .... .0.. = Reset: Not set
        .... .... ..0. = Syn: Not set
        .... .... ...0 = Fin: Not set
        [TCP Flags: ************]
    Window size value: 512
    [Calculated window size: 512]
    [Window size scaling factor: -1 (unknown)]
    Checksum: 0x28e3 [validation disabled]
        [Good Checksum: False]
        [Bad Checksum: False]
    Urgent pointer: 0

Frame 2: 54 bytes on wire (432 bits), 54 bytes captured (432 bits) on interface 0
Ethernet II, Src: 62:82:d2:70:5e:37 (62:82:d2:70:5e:37), Dst: ce:09:ed:74:57:97 (ce:09:ed:74:57:97)
Internet Protocol Version 4, Src: 10.0.0.1, Dst: 10.0.0.2
Transmission Control Protocol, Src Port: 0 (0), Dst Port: 0 (0), Seq: 1, Ack: 1, Len: 0
    Source Port: 0
    Destination Port: 0
    [Stream index: 0]
    [TCP Segment Len: 0]
    Sequence number: 1    (relative sequence number)
    Acknowledgment number: 1    (relative ack number)
    Header Length: 20 bytes
    Flags: 0x014 (RST, ACK)
        000. .... .... = Reserved: Not set
        ...0 .... .... = Nonce: Not set
        .... 0... .... = Congestion Window Reduced (CWR): Not set
        .... .0.. .... = ECN-Echo: Not set
        .... ..0. .... = Urgent: Not set
        .... ...1 .... = Acknowledgment: Set
        .... .... 0... = Push: Not set
        .... .... .1.. = Reset: Set
            [Expert Info (Warn/Sequence): Connection reset (RST)]
                [Connection reset (RST)]
                [Severity level: Warn]
                [Group: Sequence]
        .... .... ..0. = Syn: Not set
        .... .... ...0 = Fin: Not set
        [TCP Flags: *******A*R**]
    Window size value: 0
    [Calculated window size: 0]
    [Window size scaling factor: -1 (unknown)]
    Checksum: 0x3931 [validation disabled]
        [Good Checksum: False]
        [Bad Checksum: False]
    Urgent pointer: 0

Frame 3: 54 bytes on wire (432 bits), 54 bytes captured (432 bits) on interface 0
Ethernet II, Src: ce:09:ed:74:57:97 (ce:09:ed:74:57:97), Dst: 62:82:d2:70:5e:37 (62:82:d2:70:5e:37)
Internet Protocol Version 4, Src: 10.0.0.2, Dst: 10.0.0.1
Transmission Control Protocol, Src Port: 1 (1), Dst Port: 0 (0), Seq: 1, Len: 0
    Source Port: 1
    Destination Port: 0
    [Stream index: 1]
    [TCP Segment Len: 0]
    Sequence number: 1    (relative sequence number)
    Acknowledgment number: 439691221
        [Expert Info (Note/Protocol): The acknowledgment number field is nonzero while the ACK flag is not set]
            [The acknowledgment number field is nonzero while the ACK flag is not set]
            [Severity level: Note]
            [Group: Protocol]
    Header Length: 20 bytes
    Flags: 0x000 (<None>)
        000. .... .... = Reserved: Not set
        ...0 .... .... = Nonce: Not set
        .... 0... .... = Congestion Window Reduced (CWR): Not set
        .... .0.. .... = ECN-Echo: Not set
        .... ..0. .... = Urgent: Not set
        .... ...0 .... = Acknowledgment: Not set
        .... .... 0... = Push: Not set
        .... .... .0.. = Reset: Not set
        .... .... ..0. = Syn: Not set
        .... .... ...0 = Fin: Not set
        [TCP Flags: ************]
    Window size value: 512
    [Calculated window size: 512]
    [Window size scaling factor: -1 (unknown)]
    Checksum: 0x37dd [validation disabled]
        [Good Checksum: False]
        [Bad Checksum: False]
    Urgent pointer: 0

Frame 4: 54 bytes on wire (432 bits), 54 bytes captured (432 bits) on interface 0
Ethernet II, Src: 62:82:d2:70:5e:37 (62:82:d2:70:5e:37), Dst: ce:09:ed:74:57:97 (ce:09:ed:74:57:97)
Internet Protocol Version 4, Src: 10.0.0.1, Dst: 10.0.0.2
Transmission Control Protocol, Src Port: 0 (0), Dst Port: 1 (1), Seq: 1, Ack: 1, Len: 0
    Source Port: 0
    Destination Port: 1
    [Stream index: 1]
    [TCP Segment Len: 0]
    Sequence number: 1    (relative sequence number)
    Acknowledgment number: 1    (relative ack number)
    Header Length: 20 bytes
    Flags: 0x014 (RST, ACK)
        000. .... .... = Reserved: Not set
        ...0 .... .... = Nonce: Not set
        .... 0... .... = Congestion Window Reduced (CWR): Not set
        .... .0.. .... = ECN-Echo: Not set
        .... ..0. .... = Urgent: Not set
        .... ...1 .... = Acknowledgment: Set
        .... .... 0... = Push: Not set
        .... .... .1.. = Reset: Set
            [Expert Info (Warn/Sequence): Connection reset (RST)]
                [Connection reset (RST)]
                [Severity level: Warn]
                [Group: Sequence]
        .... .... ..0. = Syn: Not set
        .... .... ...0 = Fin: Not set
        [TCP Flags: *******A*R**]
    Window size value: 0
    [Calculated window size: 0]
    [Window size scaling factor: -1 (unknown)]
    Checksum: 0x7bd3 [validation disabled]
        [Good Checksum: False]
        [Bad Checksum: False]
    Urgent pointer: 0

Frame 5: 54 bytes on wire (432 bits), 54 bytes captured (432 bits) on interface 0
Ethernet II, Src: ce:09:ed:74:57:97 (ce:09:ed:74:57:97), Dst: 62:82:d2:70:5e:37 (62:82:d2:70:5e:37)
Internet Protocol Version 4, Src: 10.0.0.2, Dst: 10.0.0.1
Transmission Control Protocol, Src Port: 2 (2), Dst Port: 0 (0), Seq: 1, Len: 0
    Source Port: 2
    Destination Port: 0
    [Stream index: 2]
    [TCP Segment Len: 0]
    Sequence number: 1    (relative sequence number)
    Acknowledgment number: 848416863
        [Expert Info (Note/Protocol): The acknowledgment number field is nonzero while the ACK flag is not set]
            [The acknowledgment number field is nonzero while the ACK flag is not set]
            [Severity level: Note]
            [Group: Protocol]
    Header Length: 20 bytes
    Flags: 0x000 (<None>)
        000. .... .... = Reserved: Not set
        ...0 .... .... = Nonce: Not set
        .... 0... .... = Congestion Window Reduced (CWR): Not set
        .... .0.. .... = ECN-Echo: Not set
        .... ..0. .... = Urgent: Not set
        .... ...0 .... = Acknowledgment: Not set
        .... .... 0... = Push: Not set
        .... .... .0.. = Reset: Not set
        .... .... ..0. = Syn: Not set
        .... .... ...0 = Fin: Not set
        [TCP Flags: ************]
    Window size value: 512
    [Calculated window size: 512]
    [Window size scaling factor: -1 (unknown)]
    Checksum: 0xa0be [validation disabled]
        [Good Checksum: False]
        [Bad Checksum: False]
    Urgent pointer: 0

Frame 6: 54 bytes on wire (432 bits), 54 bytes captured (432 bits) on interface 0
Ethernet II, Src: 62:82:d2:70:5e:37 (62:82:d2:70:5e:37), Dst: ce:09:ed:74:57:97 (ce:09:ed:74:57:97)
Internet Protocol Version 4, Src: 10.0.0.1, Dst: 10.0.0.2
Transmission Control Protocol, Src Port: 0 (0), Dst Port: 2 (2), Seq: 1, Ack: 1, Len: 0
    Source Port: 0
    Destination Port: 2
    [Stream index: 2]
    [TCP Segment Len: 0]
    Sequence number: 1    (relative sequence number)
    Acknowledgment number: 1    (relative ack number)
    Header Length: 20 bytes
    Flags: 0x014 (RST, ACK)
        000. .... .... = Reserved: Not set
        ...0 .... .... = Nonce: Not set
        .... 0... .... = Congestion Window Reduced (CWR): Not set
        .... .0.. .... = ECN-Echo: Not set
        .... ..0. .... = Urgent: Not set
        .... ...1 .... = Acknowledgment: Set
        .... .... 0... = Push: Not set
        .... .... .1.. = Reset: Set
            [Expert Info (Warn/Sequence): Connection reset (RST)]
                [Connection reset (RST)]
                [Severity level: Warn]
                [Group: Sequence]
        .... .... ..0. = Syn: Not set
        .... .... ...0 = Fin: Not set
        [TCP Flags: *******A*R**]
    Window size value: 0
    [Calculated window size: 0]
    [Window size scaling factor: -1 (unknown)]
    Checksum: 0xa59b [validation disabled]
        [Good Checksum: False]
        [Bad Checksum: False]
    Urgent pointer: 0

Frame 7: 54 bytes on wire (432 bits), 54 bytes captured (432 bits) on interface 0
Ethernet II, Src: ce:09:ed:74:57:97 (ce:09:ed:74:57:97), Dst: 62:82:d2:70:5e:37 (62:82:d2:70:5e:37)
Internet Protocol Version 4, Src: 10.0.0.2, Dst: 10.0.0.1
Transmission Control Protocol, Src Port: 3 (3), Dst Port: 0 (0), Seq: 1, Len: 0
    Source Port: 3
    Destination Port: 0
    [Stream index: 3]
    [TCP Segment Len: 0]
    Sequence number: 1    (relative sequence number)
    Acknowledgment number: 2136600420
        [Expert Info (Note/Protocol): The acknowledgment number field is nonzero while the ACK flag is not set]
            [The acknowledgment number field is nonzero while the ACK flag is not set]
            [Severity level: Note]
            [Group: Protocol]
    Header Length: 20 bytes
    Flags: 0x000 (<None>)
        000. .... .... = Reserved: Not set
        ...0 .... .... = Nonce: Not set
        .... 0... .... = Congestion Window Reduced (CWR): Not set
        .... .0.. .... = ECN-Echo: Not set
        .... ..0. .... = Urgent: Not set
        .... ...0 .... = Acknowledgment: Not set
        .... .... 0... = Push: Not set
        .... .... .0.. = Reset: Not set
        .... .... ..0. = Syn: Not set
        .... .... ...0 = Fin: Not set
        [TCP Flags: ************]
    Window size value: 512
    [Calculated window size: 512]
    [Window size scaling factor: -1 (unknown)]
    Checksum: 0x7209 [validation disabled]
        [Good Checksum: False]
        [Bad Checksum: False]
    Urgent pointer: 0

Frame 8: 54 bytes on wire (432 bits), 54 bytes captured (432 bits) on interface 0
Ethernet II, Src: 62:82:d2:70:5e:37 (62:82:d2:70:5e:37), Dst: ce:09:ed:74:57:97 (ce:09:ed:74:57:97)
Internet Protocol Version 4, Src: 10.0.0.1, Dst: 10.0.0.2
Transmission Control Protocol, Src Port: 0 (0), Dst Port: 3 (3), Seq: 1, Ack: 1, Len: 0
    Source Port: 0
    Destination Port: 3
    [Stream index: 3]
    [TCP Segment Len: 0]
    Sequence number: 1    (relative sequence number)
    Acknowledgment number: 1    (relative ack number)
    Header Length: 20 bytes
    Flags: 0x014 (RST, ACK)
        000. .... .... = Reserved: Not set
        ...0 .... .... = Nonce: Not set
        .... 0... .... = Congestion Window Reduced (CWR): Not set
        .... .0.. .... = ECN-Echo: Not set
        .... ..0. .... = Urgent: Not set
        .... ...1 .... = Acknowledgment: Set
        .... .... 0... = Push: Not set
        .... .... .1.. = Reset: Set
            [Expert Info (Warn/Sequence): Connection reset (RST)]
                [Connection reset (RST)]
                [Severity level: Warn]
                [Group: Sequence]
        .... .... ..0. = Syn: Not set
        .... .... ...0 = Fin: Not set
        [TCP Flags: *******A*R**]
    Window size value: 0
    [Calculated window size: 0]
    [Window size scaling factor: -1 (unknown)]
    Checksum: 0xe2b3 [validation disabled]
        [Good Checksum: False]
        [Bad Checksum: False]
    Urgent pointer: 0

Frame 9: 54 bytes on wire (432 bits), 54 bytes captured (432 bits) on interface 0
Ethernet II, Src: ce:09:ed:74:57:97 (ce:09:ed:74:57:97), Dst: 62:82:d2:70:5e:37 (62:82:d2:70:5e:37)
Internet Protocol Version 4, Src: 10.0.0.2, Dst: 10.0.0.1
Transmission Control Protocol, Src Port: 4 (4), Dst Port: 0 (0), Seq: 1, Len: 0
    Source Port: 4
    Destination Port: 0
    [Stream index: 4]
    [TCP Segment Len: 0]
    Sequence number: 1    (relative sequence number)
    Acknowledgment number: 600723122
        [Expert Info (Note/Protocol): The acknowledgment number field is nonzero while the ACK flag is not set]
            [The acknowledgment number field is nonzero while the ACK flag is not set]
            [Severity level: Note]
            [Group: Protocol]
    Header Length: 20 bytes
    Flags: 0x000 (<None>)
        000. .... .... = Reserved: Not set
        ...0 .... .... = Nonce: Not set
        .... 0... .... = Congestion Window Reduced (CWR): Not set
        .... .0.. .... = ECN-Echo: Not set
        .... ..0. .... = Urgent: Not set
        .... ...0 .... = Acknowledgment: Not set
        .... .... 0... = Push: Not set
        .... .... .0.. = Reset: Not set
        .... .... ..0. = Syn: Not set
        .... .... ...0 = Fin: Not set
        [TCP Flags: ************]
    Window size value: 512
    [Calculated window size: 512]
    [Window size scaling factor: -1 (unknown)]
    Checksum: 0xaa87 [validation disabled]
        [Good Checksum: False]
        [Bad Checksum: False]
    Urgent pointer: 0

Frame 10: 54 bytes on wire (432 bits), 54 bytes captured (432 bits) on interface 0
Ethernet II, Src: 62:82:d2:70:5e:37 (62:82:d2:70:5e:37), Dst: ce:09:ed:74:57:97 (ce:09:ed:74:57:97)
Internet Protocol Version 4, Src: 10.0.0.1, Dst: 10.0.0.2
Transmission Control Protocol, Src Port: 0 (0), Dst Port: 4 (4), Seq: 1, Ack: 1, Len: 0
    Source Port: 0
    Destination Port: 4
    [Stream index: 4]
    [TCP Segment Len: 0]
    Sequence number: 1    (relative sequence number)
    Acknowledgment number: 1    (relative ack number)
    Header Length: 20 bytes
    Flags: 0x014 (RST, ACK)
        000. .... .... = Reserved: Not set
        ...0 .... .... = Nonce: Not set
        .... 0... .... = Congestion Window Reduced (CWR): Not set
        .... .0.. .... = ECN-Echo: Not set
        .... ..0. .... = Urgent: Not set
        .... ...1 .... = Acknowledgment: Set
        .... .... 0... = Push: Not set
        .... .... .1.. = Reset: Set
            [Expert Info (Warn/Sequence): Connection reset (RST)]
                [Connection reset (RST)]
                [Severity level: Warn]
                [Group: Sequence]
        .... .... ..0. = Syn: Not set
        .... .... ...0 = Fin: Not set
        [TCP Flags: *******A*R**]
    Window size value: 0
    [Calculated window size: 0]
    [Window size scaling factor: -1 (unknown)]
    Checksum: 0x1ef4 [validation disabled]
        [Good Checksum: False]
        [Bad Checksum: False]
    Urgent pointer: 0

Frame 11: 54 bytes on wire (432 bits), 54 bytes captured (432 bits) on interface 0
Ethernet II, Src: ce:09:ed:74:57:97 (ce:09:ed:74:57:97), Dst: 62:82:d2:70:5e:37 (62:82:d2:70:5e:37)
Internet Protocol Version 4, Src: 10.0.0.2, Dst: 10.0.0.1
Transmission Control Protocol, Src Port: 5 (5), Dst Port: 0 (0), Seq: 1, Len: 0
    Source Port: 5
    Destination Port: 0
    [Stream index: 5]
    [TCP Segment Len: 0]
    Sequence number: 1    (relative sequence number)
    Acknowledgment number: 886775784
        [Expert Info (Note/Protocol): The acknowledgment number field is nonzero while the ACK flag is not set]
            [The acknowledgment number field is nonzero while the ACK flag is not set]
            [Severity level: Note]
            [Group: Protocol]
    Header Length: 20 bytes
    Flags: 0x000 (<None>)
        000. .... .... = Reserved: Not set
        ...0 .... .... = Nonce: Not set
        .... 0... .... = Congestion Window Reduced (CWR): Not set
        .... .0.. .... = ECN-Echo: Not set
        .... ..0. .... = Urgent: Not set
        .... ...0 .... = Acknowledgment: Not set
        .... .... 0... = Push: Not set
        .... .... .0.. = Reset: Not set
        .... .... ..0. = Syn: Not set
        .... .... ...0 = Fin: Not set
        [TCP Flags: ************]
    Window size value: 512
    [Calculated window size: 512]
    [Window size scaling factor: -1 (unknown)]
    Checksum: 0x7def [validation disabled]
        [Good Checksum: False]
        [Bad Checksum: False]
    Urgent pointer: 0

Frame 12: 54 bytes on wire (432 bits), 54 bytes captured (432 bits) on interface 0
Ethernet II, Src: 62:82:d2:70:5e:37 (62:82:d2:70:5e:37), Dst: ce:09:ed:74:57:97 (ce:09:ed:74:57:97)
Internet Protocol Version 4, Src: 10.0.0.1, Dst: 10.0.0.2
Transmission Control Protocol, Src Port: 0 (0), Dst Port: 5 (5), Seq: 1, Ack: 1, Len: 0
    Source Port: 0
    Destination Port: 5
    [Stream index: 5]
    [TCP Segment Len: 0]
    Sequence number: 1    (relative sequence number)
    Acknowledgment number: 1    (relative ack number)
    Header Length: 20 bytes
    Flags: 0x014 (RST, ACK)
        000. .... .... = Reserved: Not set
        ...0 .... .... = Nonce: Not set
        .... 0... .... = Congestion Window Reduced (CWR): Not set
        .... .0.. .... = ECN-Echo: Not set
        .... ..0. .... = Urgent: Not set
        .... ...1 .... = Acknowledgment: Set
        .... .... 0... = Push: Not set
        .... .... .1.. = Reset: Set
            [Expert Info (Warn/Sequence): Connection reset (RST)]
                [Connection reset (RST)]
                [Severity level: Warn]
                [Group: Sequence]
        .... .... ..0. = Syn: Not set
        .... .... ...0 = Fin: Not set
        [TCP Flags: *******A*R**]
    Window size value: 0
    [Calculated window size: 0]
    [Window size scaling factor: -1 (unknown)]
    Checksum: 0xd49e [validation disabled]
        [Good Checksum: False]
        [Bad Checksum: False]
    Urgent pointer: 0

Frame 13: 42 bytes on wire (336 bits), 42 bytes captured (336 bits) on interface 0
Ethernet II, Src: 62:82:d2:70:5e:37 (62:82:d2:70:5e:37), Dst: ce:09:ed:74:57:97 (ce:09:ed:74:57:97)
Address Resolution Protocol (request)

Frame 14: 42 bytes on wire (336 bits), 42 bytes captured (336 bits) on interface 0
Ethernet II, Src: ce:09:ed:74:57:97 (ce:09:ed:74:57:97), Dst: 62:82:d2:70:5e:37 (62:82:d2:70:5e:37)
Address Resolution Protocol (request)

Frame 15: 42 bytes on wire (336 bits), 42 bytes captured (336 bits) on interface 0
Ethernet II, Src: 62:82:d2:70:5e:37 (62:82:d2:70:5e:37), Dst: ce:09:ed:74:57:97 (ce:09:ed:74:57:97)
Address Resolution Protocol (reply)

Frame 16: 42 bytes on wire (336 bits), 42 bytes captured (336 bits) on interface 0
Ethernet II, Src: ce:09:ed:74:57:97 (ce:09:ed:74:57:97), Dst: 62:82:d2:70:5e:37 (62:82:d2:70:5e:37)
Address Resolution Protocol (reply)

Frame 17: 54 bytes on wire (432 bits), 54 bytes captured (432 bits) on interface 0
Ethernet II, Src: ce:09:ed:74:57:97 (ce:09:ed:74:57:97), Dst: 62:82:d2:70:5e:37 (62:82:d2:70:5e:37)
Internet Protocol Version 4, Src: 10.0.0.2, Dst: 10.0.0.1
Transmission Control Protocol, Src Port: 6 (6), Dst Port: 0 (0), Seq: 1, Len: 0
    Source Port: 6
    Destination Port: 0
    [Stream index: 6]
    [TCP Segment Len: 0]
    Sequence number: 1    (relative sequence number)
    Acknowledgment number: 637107078
        [Expert Info (Note/Protocol): The acknowledgment number field is nonzero while the ACK flag is not set]
            [The acknowledgment number field is nonzero while the ACK flag is not set]
            [Severity level: Note]
            [Group: Protocol]
    Header Length: 20 bytes
    Flags: 0x000 (<None>)
        000. .... .... = Reserved: Not set
        ...0 .... .... = Nonce: Not set
        .... 0... .... = Congestion Window Reduced (CWR): Not set
        .... .0.. .... = ECN-Echo: Not set
        .... ..0. .... = Urgent: Not set
        .... ...0 .... = Acknowledgment: Not set
        .... .... 0... = Push: Not set
        .... .... .0.. = Reset: Not set
        .... .... ..0. = Syn: Not set
        .... .... ...0 = Fin: Not set
        [TCP Flags: ************]
    Window size value: 512
    [Calculated window size: 512]
    [Window size scaling factor: -1 (unknown)]
    Checksum: 0x346a [validation disabled]
        [Good Checksum: False]
        [Bad Checksum: False]
    Urgent pointer: 0

Frame 18: 54 bytes on wire (432 bits), 54 bytes captured (432 bits) on interface 0
Ethernet II, Src: 62:82:d2:70:5e:37 (62:82:d2:70:5e:37), Dst: ce:09:ed:74:57:97 (ce:09:ed:74:57:97)
Internet Protocol Version 4, Src: 10.0.0.1, Dst: 10.0.0.2
Transmission Control Protocol, Src Port: 0 (0), Dst Port: 6 (6), Seq: 1, Ack: 1, Len: 0
    Source Port: 0
    Destination Port: 6
    [Stream index: 6]
    [TCP Segment Len: 0]
    Sequence number: 1    (relative sequence number)
    Acknowledgment number: 1    (relative ack number)
    Header Length: 20 bytes
    Flags: 0x014 (RST, ACK)
        000. .... .... = Reserved: Not set
        ...0 .... .... = Nonce: Not set
        .... 0... .... = Congestion Window Reduced (CWR): Not set
        .... .0.. .... = ECN-Echo: Not set
        .... ..0. .... = Urgent: Not set
        .... ...1 .... = Acknowledgment: Set
        .... .... 0... = Push: Not set
        .... .... .1.. = Reset: Set
            [Expert Info (Warn/Sequence): Connection reset (RST)]
                [Connection reset (RST)]
                [Severity level: Warn]
                [Group: Sequence]
        .... .... ..0. = Syn: Not set
        .... .... ...0 = Fin: Not set
        [TCP Flags: *******A*R**]
    Window size value: 0
    [Calculated window size: 0]
    [Window size scaling factor: -1 (unknown)]
    Checksum: 0xd7d5 [validation disabled]
        [Good Checksum: False]
        [Bad Checksum: False]
    Urgent pointer: 0

Frame 19: 54 bytes on wire (432 bits), 54 bytes captured (432 bits) on interface 0
Ethernet II, Src: ce:09:ed:74:57:97 (ce:09:ed:74:57:97), Dst: 62:82:d2:70:5e:37 (62:82:d2:70:5e:37)
Internet Protocol Version 4, Src: 10.0.0.2, Dst: 10.0.0.1
Transmission Control Protocol, Src Port: 7 (7), Dst Port: 0 (0), Seq: 1, Len: 0
    Source Port: 7
    Destination Port: 0
    [Stream index: 7]
    [TCP Segment Len: 0]
    Sequence number: 1    (relative sequence number)
    Acknowledgment number: 635738827
        [Expert Info (Note/Protocol): The acknowledgment number field is nonzero while the ACK flag is not set]
            [The acknowledgment number field is nonzero while the ACK flag is not set]
            [Severity level: Note]
            [Group: Protocol]
    Header Length: 20 bytes
    Flags: 0x000 (<None>)
        000. .... .... = Reserved: Not set
        ...0 .... .... = Nonce: Not set
        .... 0... .... = Congestion Window Reduced (CWR): Not set
        .... .0.. .... = ECN-Echo: Not set
        .... ..0. .... = Urgent: Not set
        .... ...0 .... = Acknowledgment: Not set
        .... .... 0... = Push: Not set
        .... .... .0.. = Reset: Not set
        .... .... ..0. = Syn: Not set
        .... .... ...0 = Fin: Not set
        [TCP Flags: ************]
    Window size value: 512
    [Calculated window size: 512]
    [Window size scaling factor: -1 (unknown)]
    Checksum: 0x1158 [validation disabled]
        [Good Checksum: False]
        [Bad Checksum: False]
    Urgent pointer: 0

Frame 20: 54 bytes on wire (432 bits), 54 bytes captured (432 bits) on interface 0
Ethernet II, Src: 62:82:d2:70:5e:37 (62:82:d2:70:5e:37), Dst: ce:09:ed:74:57:97 (ce:09:ed:74:57:97)
Internet Protocol Version 4, Src: 10.0.0.1, Dst: 10.0.0.2
Transmission Control Protocol, Src Port: 0 (0), Dst Port: 7 (7), Seq: 1, Ack: 1, Len: 0
    Source Port: 0
    Destination Port: 7
    [Stream index: 7]
    [TCP Segment Len: 0]
    Sequence number: 1    (relative sequence number)
    Acknowledgment number: 1    (relative ack number)
    Header Length: 20 bytes
    Flags: 0x014 (RST, ACK)
        000. .... .... = Reserved: Not set
        ...0 .... .... = Nonce: Not set
        .... 0... .... = Congestion Window Reduced (CWR): Not set
        .... .0.. .... = ECN-Echo: Not set
        .... ..0. .... = Urgent: Not set
        .... ...1 .... = Acknowledgment: Set
        .... .... 0... = Push: Not set
        .... .... .1.. = Reset: Set
            [Expert Info (Warn/Sequence): Connection reset (RST)]
                [Connection reset (RST)]
                [Severity level: Warn]
                [Group: Sequence]
        .... .... ..0. = Syn: Not set
        .... .... ...0 = Fin: Not set
        [TCP Flags: *******A*R**]
    Window size value: 0
    [Calculated window size: 0]
    [Window size scaling factor: -1 (unknown)]
    Checksum: 0xd3f3 [validation disabled]
        [Good Checksum: False]
        [Bad Checksum: False]
    Urgent pointer: 0

Frame 21: 54 bytes on wire (432 bits), 54 bytes captured (432 bits) on interface 0
Ethernet II, Src: ce:09:ed:74:57:97 (ce:09:ed:74:57:97), Dst: 62:82:d2:70:5e:37 (62:82:d2:70:5e:37)
Internet Protocol Version 4, Src: 10.0.0.2, Dst: 10.0.0.1
Transmission Control Protocol, Src Port: 8 (8), Dst Port: 0 (0), Seq: 1, Len: 0
    Source Port: 8
    Destination Port: 0
    [Stream index: 8]
    [TCP Segment Len: 0]
    Sequence number: 1    (relative sequence number)
    Acknowledgment number: 1465140689
        [Expert Info (Note/Protocol): The acknowledgment number field is nonzero while the ACK flag is not set]
            [The acknowledgment number field is nonzero while the ACK flag is not set]
            [Severity level: Note]
            [Group: Protocol]
    Header Length: 20 bytes
    Flags: 0x000 (<None>)
        000. .... .... = Reserved: Not set
        ...0 .... .... = Nonce: Not set
        .... 0... .... = Congestion Window Reduced (CWR): Not set
        .... .0.. .... = ECN-Echo: Not set
        .... ..0. .... = Urgent: Not set
        .... ...0 .... = Acknowledgment: Not set
        .... .... 0... = Push: Not set
        .... .... .0.. = Reset: Not set
        .... .... ..0. = Syn: Not set
        .... .... ...0 = Fin: Not set
        [TCP Flags: ************]
    Window size value: 512
    [Calculated window size: 512]
    [Window size scaling factor: -1 (unknown)]
    Checksum: 0x9ebc [validation disabled]
        [Good Checksum: False]
        [Bad Checksum: False]
    Urgent pointer: 0

Frame 22: 54 bytes on wire (432 bits), 54 bytes captured (432 bits) on interface 0
Ethernet II, Src: 62:82:d2:70:5e:37 (62:82:d2:70:5e:37), Dst: ce:09:ed:74:57:97 (ce:09:ed:74:57:97)
Internet Protocol Version 4, Src: 10.0.0.1, Dst: 10.0.0.2
Transmission Control Protocol, Src Port: 0 (0), Dst Port: 8 (8), Seq: 1, Ack: 1, Len: 0
    Source Port: 0
    Destination Port: 8
    [Stream index: 8]
    [TCP Segment Len: 0]
    Sequence number: 1    (relative sequence number)
    Acknowledgment number: 1    (relative ack number)
    Header Length: 20 bytes
    Flags: 0x014 (RST, ACK)
        000. .... .... = Reserved: Not set
        ...0 .... .... = Nonce: Not set
        .... 0... .... = Congestion Window Reduced (CWR): Not set
        .... .0.. .... = ECN-Echo: Not set
        .... ..0. .... = Urgent: Not set
        .... ...1 .... = Acknowledgment: Set
        .... .... 0... = Push: Not set
        .... .... .1.. = Reset: Set
            [Expert Info (Warn/Sequence): Connection reset (RST)]
                [Connection reset (RST)]
                [Severity level: Warn]
                [Group: Sequence]
        .... .... ..0. = Syn: Not set
        .... .... ...0 = Fin: Not set
        [TCP Flags: *******A*R**]
    Window size value: 0
    [Calculated window size: 0]
    [Window size scaling factor: -1 (unknown)]
    Checksum: 0x3dce [validation disabled]
        [Good Checksum: False]
        [Bad Checksum: False]
    Urgent pointer: 0

Frame 23: 54 bytes on wire (432 bits), 54 bytes captured (432 bits) on interface 0
Ethernet II, Src: ce:09:ed:74:57:97 (ce:09:ed:74:57:97), Dst: 62:82:d2:70:5e:37 (62:82:d2:70:5e:37)
Internet Protocol Version 4, Src: 10.0.0.2, Dst: 10.0.0.1
Transmission Control Protocol, Src Port: 9 (9), Dst Port: 0 (0), Seq: 1, Len: 0
    Source Port: 9
    Destination Port: 0
    [Stream index: 9]
    [TCP Segment Len: 0]
    Sequence number: 1    (relative sequence number)
    Acknowledgment number: 2132039604
        [Expert Info (Note/Protocol): The acknowledgment number field is nonzero while the ACK flag is not set]
            [The acknowledgment number field is nonzero while the ACK flag is not set]
            [Severity level: Note]
            [Group: Protocol]
    Header Length: 20 bytes
    Flags: 0x000 (<None>)
        000. .... .... = Reserved: Not set
        ...0 .... .... = Nonce: Not set
        .... 0... .... = Congestion Window Reduced (CWR): Not set
        .... .0.. .... = ECN-Echo: Not set
        .... ..0. .... = Urgent: Not set
        .... ...0 .... = Acknowledgment: Not set
        .... .... 0... = Push: Not set
        .... .... .0.. = Reset: Not set
        .... .... ..0. = Syn: Not set
        .... .... ...0 = Fin: Not set
        [TCP Flags: ************]
    Window size value: 512
    [Calculated window size: 512]
    [Window size scaling factor: -1 (unknown)]
    Checksum: 0xf2b9 [validation disabled]
        [Good Checksum: False]
        [Bad Checksum: False]
    Urgent pointer: 0

Frame 24: 54 bytes on wire (432 bits), 54 bytes captured (432 bits) on interface 0
Ethernet II, Src: 62:82:d2:70:5e:37 (62:82:d2:70:5e:37), Dst: ce:09:ed:74:57:97 (ce:09:ed:74:57:97)
Internet Protocol Version 4, Src: 10.0.0.1, Dst: 10.0.0.2
Transmission Control Protocol, Src Port: 0 (0), Dst Port: 9 (9), Seq: 1, Ack: 1, Len: 0
    Source Port: 0
    Destination Port: 9
    [Stream index: 9]
    [TCP Segment Len: 0]
    Sequence number: 1    (relative sequence number)
    Acknowledgment number: 1    (relative ack number)
    Header Length: 20 bytes
    Flags: 0x014 (RST, ACK)
        000. .... .... = Reserved: Not set
        ...0 .... .... = Nonce: Not set
        .... 0... .... = Congestion Window Reduced (CWR): Not set
        .... .0.. .... = ECN-Echo: Not set
        .... ..0. .... = Urgent: Not set
        .... ...1 .... = Acknowledgment: Set
        .... .... 0... = Push: Not set
        .... .... .1.. = Reset: Set
            [Expert Info (Warn/Sequence): Connection reset (RST)]
                [Connection reset (RST)]
                [Severity level: Warn]
                [Group: Sequence]
        .... .... ..0. = Syn: Not set
        .... .... ...0 = Fin: Not set
        [TCP Flags: *******A*R**]
    Window size value: 0
    [Calculated window size: 0]
    [Window size scaling factor: -1 (unknown)]
    Checksum: 0xcb6e [validation disabled]
        [Good Checksum: False]
        [Bad Checksum: False]
    Urgent pointer: 0

Frame 25: 54 bytes on wire (432 bits), 54 bytes captured (432 bits) on interface 0
Ethernet II, Src: ce:09:ed:74:57:97 (ce:09:ed:74:57:97), Dst: 62:82:d2:70:5e:37 (62:82:d2:70:5e:37)
Internet Protocol Version 4, Src: 10.0.0.2, Dst: 10.0.0.1
Transmission Control Protocol, Src Port: 10 (10), Dst Port: 0 (0), Seq: 1, Len: 0
    Source Port: 10
    Destination Port: 0
    [Stream index: 10]
    [TCP Segment Len: 0]
    Sequence number: 1    (relative sequence number)
    Acknowledgment number: 1345743151
        [Expert Info (Note/Protocol): The acknowledgment number field is nonzero while the ACK flag is not set]
            [The acknowledgment number field is nonzero while the ACK flag is not set]
            [Severity level: Note]
            [Group: Protocol]
    Header Length: 20 bytes
    Flags: 0x000 (<None>)
        000. .... .... = Reserved: Not set
        ...0 .... .... = Nonce: Not set
        .... 0... .... = Congestion Window Reduced (CWR): Not set
        .... .0.. .... = ECN-Echo: Not set
        .... ..0. .... = Urgent: Not set
        .... ...0 .... = Acknowledgment: Not set
        .... .... 0... = Push: Not set
        .... .... .0.. = Reset: Not set
        .... .... ..0. = Syn: Not set
        .... .... ...0 = Fin: Not set
        [TCP Flags: ************]
    Window size value: 512
    [Calculated window size: 512]
    [Window size scaling factor: -1 (unknown)]
    Checksum: 0x6aa7 [validation disabled]
        [Good Checksum: False]
        [Bad Checksum: False]
    Urgent pointer: 0

Frame 26: 54 bytes on wire (432 bits), 54 bytes captured (432 bits) on interface 0
Ethernet II, Src: 62:82:d2:70:5e:37 (62:82:d2:70:5e:37), Dst: ce:09:ed:74:57:97 (ce:09:ed:74:57:97)
Internet Protocol Version 4, Src: 10.0.0.1, Dst: 10.0.0.2
Transmission Control Protocol, Src Port: 0 (0), Dst Port: 10 (10), Seq: 1, Ack: 1, Len: 0
    Source Port: 0
    Destination Port: 10
    [Stream index: 10]
    [TCP Segment Len: 0]
    Sequence number: 1    (relative sequence number)
    Acknowledgment number: 1    (relative ack number)
    Header Length: 20 bytes
    Flags: 0x014 (RST, ACK)
        000. .... .... = Reserved: Not set
        ...0 .... .... = Nonce: Not set
        .... 0... .... = Congestion Window Reduced (CWR): Not set
        .... .0.. .... = ECN-Echo: Not set
        .... ..0. .... = Urgent: Not set
        .... ...1 .... = Acknowledgment: Set
        .... .... 0... = Push: Not set
        .... .... .1.. = Reset: Set
            [Expert Info (Warn/Sequence): Connection reset (RST)]
                [Connection reset (RST)]
                [Severity level: Warn]
                [Group: Sequence]
        .... .... ..0. = Syn: Not set
        .... .... ...0 = Fin: Not set
        [TCP Flags: *******A*R**]
    Window size value: 0
    [Calculated window size: 0]
    [Window size scaling factor: -1 (unknown)]
    Checksum: 0x25f9 [validation disabled]
        [Good Checksum: False]
        [Bad Checksum: False]
    Urgent pointer: 0

Frame 27: 54 bytes on wire (432 bits), 54 bytes captured (432 bits) on interface 0
Ethernet II, Src: ce:09:ed:74:57:97 (ce:09:ed:74:57:97), Dst: 62:82:d2:70:5e:37 (62:82:d2:70:5e:37)
Internet Protocol Version 4, Src: 10.0.0.2, Dst: 10.0.0.1
Transmission Control Protocol, Src Port: 11 (11), Dst Port: 0 (0), Seq: 1, Len: 0
    Source Port: 11
    Destination Port: 0
    [Stream index: 11]
    [TCP Segment Len: 0]
    Sequence number: 1    (relative sequence number)
    Acknowledgment number: 2027249803
        [Expert Info (Note/Protocol): The acknowledgment number field is nonzero while the ACK flag is not set]
            [The acknowledgment number field is nonzero while the ACK flag is not set]
            [Severity level: Note]
            [Group: Protocol]
    Header Length: 20 bytes
    Flags: 0x000 (<None>)
        000. .... .... = Reserved: Not set
        ...0 .... .... = Nonce: Not set
        .... 0... .... = Congestion Window Reduced (CWR): Not set
        .... .0.. .... = ECN-Echo: Not set
        .... ..0. .... = Urgent: Not set
        .... ...0 .... = Acknowledgment: Not set
        .... .... 0... = Push: Not set
        .... .... .0.. = Reset: Not set
        .... .... ..0. = Syn: Not set
        .... .... ...0 = Fin: Not set
        [TCP Flags: ************]
    Window size value: 512
    [Calculated window size: 512]
    [Window size scaling factor: -1 (unknown)]
    Checksum: 0x5997 [validation disabled]
        [Good Checksum: False]
        [Bad Checksum: False]
    Urgent pointer: 0

Frame 28: 54 bytes on wire (432 bits), 54 bytes captured (432 bits) on interface 0
Ethernet II, Src: 62:82:d2:70:5e:37 (62:82:d2:70:5e:37), Dst: ce:09:ed:74:57:97 (ce:09:ed:74:57:97)
Internet Protocol Version 4, Src: 10.0.0.1, Dst: 10.0.0.2
Transmission Control Protocol, Src Port: 0 (0), Dst Port: 11 (11), Seq: 1, Ack: 1, Len: 0
    Source Port: 0
    Destination Port: 11
    [Stream index: 11]
    [TCP Segment Len: 0]
    Sequence number: 1    (relative sequence number)
    Acknowledgment number: 1    (relative ack number)
    Header Length: 20 bytes
    Flags: 0x014 (RST, ACK)
        000. .... .... = Reserved: Not set
        ...0 .... .... = Nonce: Not set
        .... 0... .... = Congestion Window Reduced (CWR): Not set
        .... .0.. .... = ECN-Echo: Not set
        .... ..0. .... = Urgent: Not set
        .... ...1 .... = Acknowledgment: Set
        .... .... 0... = Push: Not set
        .... .... .1.. = Reset: Set
            [Expert Info (Warn/Sequence): Connection reset (RST)]
                [Connection reset (RST)]
                [Severity level: Warn]
                [Group: Sequence]
        .... .... ..0. = Syn: Not set
        .... .... ...0 = Fin: Not set
        [TCP Flags: *******A*R**]
    Window size value: 0
    [Calculated window size: 0]
    [Window size scaling factor: -1 (unknown)]
    Checksum: 0x34e4 [validation disabled]
        [Good Checksum: False]
        [Bad Checksum: False]
    Urgent pointer: 0

Frame 29: 54 bytes on wire (432 bits), 54 bytes captured (432 bits) on interface 0
Ethernet II, Src: ce:09:ed:74:57:97 (ce:09:ed:74:57:97), Dst: 62:82:d2:70:5e:37 (62:82:d2:70:5e:37)
Internet Protocol Version 4, Src: 10.0.0.2, Dst: 10.0.0.1
Transmission Control Protocol, Src Port: 12 (12), Dst Port: 0 (0), Seq: 1, Len: 0
    Source Port: 12
    Destination Port: 0
    [Stream index: 12]
    [TCP Segment Len: 0]
    Sequence number: 1    (relative sequence number)
    Acknowledgment number: 1746724724
        [Expert Info (Note/Protocol): The acknowledgment number field is nonzero while the ACK flag is not set]
            [The acknowledgment number field is nonzero while the ACK flag is not set]
            [Severity level: Note]
            [Group: Protocol]
    Header Length: 20 bytes
    Flags: 0x000 (<None>)
        000. .... .... = Reserved: Not set
        ...0 .... .... = Nonce: Not set
        .... 0... .... = Congestion Window Reduced (CWR): Not set
        .... .0.. .... = ECN-Echo: Not set
        .... ..0. .... = Urgent: Not set
        .... ...0 .... = Acknowledgment: Not set
        .... .... 0... = Push: Not set
        .... .... .0.. = Reset: Not set
        .... .... ..0. = Syn: Not set
        .... .... ...0 = Fin: Not set
        [TCP Flags: ************]
    Window size value: 512
    [Calculated window size: 512]
    [Window size scaling factor: -1 (unknown)]
    Checksum: 0x7400 [validation disabled]
        [Good Checksum: False]
        [Bad Checksum: False]
    Urgent pointer: 0

Frame 30: 54 bytes on wire (432 bits), 54 bytes captured (432 bits) on interface 0
Ethernet II, Src: 62:82:d2:70:5e:37 (62:82:d2:70:5e:37), Dst: ce:09:ed:74:57:97 (ce:09:ed:74:57:97)
Internet Protocol Version 4, Src: 10.0.0.1, Dst: 10.0.0.2
Transmission Control Protocol, Src Port: 0 (0), Dst Port: 12 (12), Seq: 1, Ack: 1, Len: 0
    Source Port: 0
    Destination Port: 12
    [Stream index: 12]
    [TCP Segment Len: 0]
    Sequence number: 1    (relative sequence number)
    Acknowledgment number: 1    (relative ack number)
    Header Length: 20 bytes
    Flags: 0x014 (RST, ACK)
        000. .... .... = Reserved: Not set
        ...0 .... .... = Nonce: Not set
        .... 0... .... = Congestion Window Reduced (CWR): Not set
        .... .0.. .... = ECN-Echo: Not set
        .... ..0. .... = Urgent: Not set
        .... ...1 .... = Acknowledgment: Set
        .... .... 0... = Push: Not set
        .... .... .1.. = Reset: Set
            [Expert Info (Warn/Sequence): Connection reset (RST)]
                [Connection reset (RST)]
                [Severity level: Warn]
                [Group: Sequence]
        .... .... ..0. = Syn: Not set
        .... .... ...0 = Fin: Not set
        [TCP Flags: *******A*R**]
    Window size value: 0
    [Calculated window size: 0]
    [Window size scaling factor: -1 (unknown)]
    Checksum: 0xc57d [validation disabled]
        [Good Checksum: False]
        [Bad Checksum: False]
    Urgent pointer: 0

Frame 31: 54 bytes on wire (432 bits), 54 bytes captured (432 bits) on interface 0
Ethernet II, Src: ce:09:ed:74:57:97 (ce:09:ed:74:57:97), Dst: 62:82:d2:70:5e:37 (62:82:d2:70:5e:37)
Internet Protocol Version 4, Src: 10.0.0.2, Dst: 10.0.0.1
Transmission Control Protocol, Src Port: 13 (13), Dst Port: 0 (0), Seq: 1, Len: 0
