  1 0.000000000     10.0.0.2 -> 10.0.0.1     TCP 54 0 → 0 [<None>] Seq=1 Win=512 Len=0
  2 0.000015050     10.0.0.1 -> 10.0.0.2     TCP 54 0 → 0 [RST, ACK] Seq=1 Ack=1 Win=0 Len=0
  3 0.999989658     10.0.0.2 -> 10.0.0.1     TCP 54 1 → 0 [<None>] Seq=1 Win=512 Len=0
  4 1.000005055     10.0.0.1 -> 10.0.0.2     TCP 54 0 → 1 [RST, ACK] Seq=1 Ack=1 Win=0 Len=0
  5 2.000086096     10.0.0.2 -> 10.0.0.1     TCP 54 2 → 0 [<None>] Seq=1 Win=512 Len=0
  6 2.000101812     10.0.0.1 -> 10.0.0.2     TCP 54 0 → 2 [RST, ACK] Seq=1 Ack=1 Win=0 Len=0
  7 3.000173202     10.0.0.2 -> 10.0.0.1     TCP 54 3 → 0 [<None>] Seq=1 Win=512 Len=0
  8 3.000188634     10.0.0.1 -> 10.0.0.2     TCP 54 0 → 3 [RST, ACK] Seq=1 Ack=1 Win=0 Len=0
  9 4.000267365     10.0.0.2 -> 10.0.0.1     TCP 54 4 → 0 [<None>] Seq=1 Win=512 Len=0
 10 4.000282758     10.0.0.1 -> 10.0.0.2     TCP 54 0 → 4 [RST, ACK] Seq=1 Ack=1 Win=0 Len=0
 11 5.000333104     10.0.0.2 -> 10.0.0.1     TCP 54 5 → 0 [<None>] Seq=1 Win=512 Len=0
 12 5.000350658     10.0.0.1 -> 10.0.0.2     TCP 54 0 → 5 [RST, ACK] Seq=1 Ack=1 Win=0 Len=0
 13 5.015792146 62:82:d2:70:5e:37 -> ce:09:ed:74:57:97 ARP 42 Who has 10.0.0.2? Tell 10.0.0.1
 14 5.015930828 ce:09:ed:74:57:97 -> 62:82:d2:70:5e:37 ARP 42 Who has 10.0.0.1? Tell 10.0.0.2
 15 5.015935371 62:82:d2:70:5e:37 -> ce:09:ed:74:57:97 ARP 42 10.0.0.1 is at 62:82:d2:70:5e:37
 16 5.015974370 ce:09:ed:74:57:97 -> 62:82:d2:70:5e:37 ARP 42 10.0.0.2 is at ce:09:ed:74:57:97
 17 6.000457531     10.0.0.2 -> 10.0.0.1     TCP 54 6 → 0 [<None>] Seq=1 Win=512 Len=0
 18 6.000473064     10.0.0.1 -> 10.0.0.2     TCP 54 0 → 6 [RST, ACK] Seq=1 Ack=1 Win=0 Len=0
 19 7.000516599     10.0.0.2 -> 10.0.0.1     TCP 54 7 → 0 [<None>] Seq=1 Win=512 Len=0
 20 7.000531394     10.0.0.1 -> 10.0.0.2     TCP 54 0 → 7 [RST, ACK] Seq=1 Ack=1 Win=0 Len=0
 21 8.000608585     10.0.0.2 -> 10.0.0.1     TCP 54 8 → 0 [<None>] Seq=1 Win=512 Len=0
 22 8.000622104     10.0.0.1 -> 10.0.0.2     TCP 54 0 → 8 [RST, ACK] Seq=1 Ack=1 Win=0 Len=0
 23 9.000692729     10.0.0.2 -> 10.0.0.1     TCP 54 9 → 0 [<None>] Seq=1 Win=512 Len=0
 24 9.000705468     10.0.0.1 -> 10.0.0.2     TCP 54 0 → 9 [RST, ACK] Seq=1 Ack=1 Win=0 Len=0
 25 10.000809788     10.0.0.2 -> 10.0.0.1     TCP 54 10 → 0 [<None>] Seq=1 Win=512 Len=0
 26 10.000825023     10.0.0.1 -> 10.0.0.2     TCP 54 0 → 10 [RST, ACK] Seq=1 Ack=1 Win=0 Len=0
 27 11.000930090     10.0.0.2 -> 10.0.0.1     TCP 54 11 → 0 [<None>] Seq=1 Win=512 Len=0
 28 11.000945097     10.0.0.1 -> 10.0.0.2     TCP 54 0 → 11 [RST, ACK] Seq=1 Ack=1 Win=0 Len=0
 29 12.001052484     10.0.0.2 -> 10.0.0.1     TCP 54 12 → 0 [<None>] Seq=1 Win=512 Len=0
 30 12.001066902     10.0.0.1 -> 10.0.0.2     TCP 54 0 → 12 [RST, ACK] Seq=1 Ack=1 Win=0 Len=0
 31 13.001174356     10.0.0.2 -> 10.0.0.1     TCP 54 13 → 0 [<None>] Seq=1 Win=512 Len=0
 32 13.001189674     10.0.0.1 -> 10.0.0.2     TCP 54 0 → 13 [RST, ACK] Seq=1 Ack=1 Win=0 Len=0
 33 14.001243346     10.0.0.2 -> 10.0.0.1     TCP 54 14 → 0 [<None>] Seq=1 Win=512 Len=0
 34 14.001258465     10.0.0.1 -> 10.0.0.2     TCP 54 0 → 14 [RST, ACK] Seq=1 Ack=1 Win=0 Len=0
 35 15.001299522     10.0.0.2 -> 10.0.0.1     TCP 54 15 → 0 [<None>] Seq=1 Win=512 Len=0
 36 15.001314575     10.0.0.1 -> 10.0.0.2     TCP 54 0 → 15 [RST, ACK] Seq=1 Ack=1 Win=0 Len=0
 37 16.001427534     10.0.0.2 -> 10.0.0.1     TCP 54 16 → 0 [<None>] Seq=1 Win=512 Len=0
 38 16.001442033     10.0.0.1 -> 10.0.0.2     TCP 54 0 → 16 [RST, ACK] Seq=1 Ack=1 Win=0 Len=0
 39 17.001546177     10.0.0.2 -> 10.0.0.1     TCP 54 17 → 0 [<None>] Seq=1 Win=512 Len=0
 40 17.001566439     10.0.0.1 -> 10.0.0.2     TCP 54 0 → 17 [RST, ACK] Seq=1 Ack=1 Win=0 Len=0
 41 18.001678041     10.0.0.2 -> 10.0.0.1     TCP 54 18 → 0 [<None>] Seq=1 Win=512 Len=0
 42 18.001693062     10.0.0.1 -> 10.0.0.2     TCP 54 0 → 18 [RST, ACK] Seq=1 Ack=1 Win=0 Len=0
 43 19.001741669     10.0.0.2 -> 10.0.0.1     TCP 54 19 → 0 [<None>] Seq=1 Win=512 Len=0
 44 19.001757522     10.0.0.1 -> 10.0.0.2     TCP 54 0 → 19 [RST, ACK] Seq=1 Ack=1 Win=0 Len=0
 45 20.001797017     10.0.0.2 -> 10.0.0.1     TCP 54 20 → 0 [<None>] Seq=1 Win=512 Len=0
 46 20.001809888     10.0.0.1 -> 10.0.0.2     TCP 54 0 → 20 [RST, ACK] Seq=1 Ack=1 Win=0 Len=0
 47 21.001918480     10.0.0.2 -> 10.0.0.1     TCP 54 21 → 0 [<None>] Seq=1 Win=512 Len=0
 48 21.001933479     10.0.0.1 -> 10.0.0.2     TCP 54 0 → 21 [RST, ACK] Seq=1 Ack=1 Win=0 Len=0
 49 22.002003403     10.0.0.2 -> 10.0.0.1     TCP 54 22 → 0 [<None>] Seq=1 Win=512 Len=0
 50 22.002018291     10.0.0.1 -> 10.0.0.2     TCP 54 0 → 22 [RST, ACK] Seq=1 Ack=1 Win=0 Len=0
 51 23.002089093     10.0.0.2 -> 10.0.0.1     TCP 54 23 → 0 [<None>] Seq=1 Win=512 Len=0
 52 23.002103535     10.0.0.1 -> 10.0.0.2     TCP 54 0 → 23 [RST, ACK] Seq=1 Ack=1 Win=0 Len=0
 53 24.002219187     10.0.0.2 -> 10.0.0.1     TCP 54 24 → 0 [<None>] Seq=1 Win=512 Len=0
 54 24.002234154     10.0.0.1 -> 10.0.0.2     TCP 54 0 → 24 [RST, ACK] Seq=1 Ack=1 Win=0 Len=0
 55 25.002340545     10.0.0.2 -> 10.0.0.1     TCP 54 25 → 0 [<None>] Seq=1 Win=512 Len=0
 56 25.002355371     10.0.0.1 -> 10.0.0.2     TCP 54 0 → 25 [RST, ACK] Seq=1 Ack=1 Win=0 Len=0
 57 26.002428189     10.0.0.2 -> 10.0.0.1     TCP 54 26 → 0 [<None>] Seq=1 Win=512 Len=0
 58 26.002443186     10.0.0.1 -> 10.0.0.2     TCP 54 0 → 26 [RST, ACK] Seq=1 Ack=1 Win=0 Len=0
 59 27.002513706     10.0.0.2 -> 10.0.0.1     TCP 54 27 → 0 [<None>] Seq=1 Win=512 Len=0
 60 27.002528230     10.0.0.1 -> 10.0.0.2     TCP 54 0 → 27 [RST, ACK] Seq=1 Ack=1 Win=0 Len=0
 61 28.002576377     10.0.0.2 -> 10.0.0.1     TCP 54 28 → 0 [<None>] Seq=1 Win=512 Len=0
 62 28.002589866     10.0.0.1 -> 10.0.0.2     TCP 54 0 → 28 [RST, ACK] Seq=1 Ack=1 Win=0 Len=0
 63 29.002731177     10.0.0.2 -> 10.0.0.1     TCP 54 29 → 0 [<None>] Seq=1 Win=512 Len=0
 64 29.002744310     10.0.0.1 -> 10.0.0.2     TCP 54 0 → 29 [RST, ACK] Seq=1 Ack=1 Win=0 Len=0
 65 30.002804333     10.0.0.2 -> 10.0.0.1     TCP 54 30 → 0 [<None>] Seq=1 Win=512 Len=0
 66 30.002818867     10.0.0.1 -> 10.0.0.2     TCP 54 0 → 30 [RST, ACK] Seq=1 Ack=1 Win=0 Len=0
 67 31.002884927     10.0.0.2 -> 10.0.0.1     TCP 54 31 → 0 [<None>] Seq=1 Win=512 Len=0
 68 31.002897311     10.0.0.1 -> 10.0.0.2     TCP 54 0 → 31 [RST, ACK] Seq=1 Ack=1 Win=0 Len=0
 69 32.003040030     10.0.0.2 -> 10.0.0.1     TCP 54 32 → 0 [<None>] Seq=1 Win=512 Len=0
 70 32.003055574     10.0.0.1 -> 10.0.0.2     TCP 54 0 → 32 [RST, ACK] Seq=1 Ack=1 Win=0 Len=0
 71 33.003148161     10.0.0.2 -> 10.0.0.1     TCP 54 33 → 0 [<None>] Seq=1 Win=512 Len=0
 72 33.003162396     10.0.0.1 -> 10.0.0.2     TCP 54 0 → 33 [RST, ACK] Seq=1 Ack=1 Win=0 Len=0
 73 34.003267086     10.0.0.2 -> 10.0.0.1     TCP 54 34 → 0 [<None>] Seq=1 Win=512 Len=0
 74 34.003282826     10.0.0.1 -> 10.0.0.2     TCP 54 0 → 34 [RST, ACK] Seq=1 Ack=1 Win=0 Len=0
 75 35.003352235     10.0.0.2 -> 10.0.0.1     TCP 54 35 → 0 [<None>] Seq=1 Win=512 Len=0
 76 35.003366795     10.0.0.1 -> 10.0.0.2     TCP 54 0 → 35 [RST, ACK] Seq=1 Ack=1 Win=0 Len=0
 77 36.003445660     10.0.0.2 -> 10.0.0.1     TCP 54 36 → 0 [<None>] Seq=1 Win=512 Len=0
 78 36.003462786     10.0.0.1 -> 10.0.0.2     TCP 54 0 → 36 [RST, ACK] Seq=1 Ack=1 Win=0 Len=0
 79 37.003555251     10.0.0.2 -> 10.0.0.1     TCP 54 37 → 0 [<None>] Seq=1 Win=512 Len=0
 80 37.003570210     10.0.0.1 -> 10.0.0.2     TCP 54 0 → 37 [RST, ACK] Seq=1 Ack=1 Win=0 Len=0
 81 38.003618917     10.0.0.2 -> 10.0.0.1     TCP 54 38 → 0 [<None>] Seq=1 Win=512 Len=0
 82 38.003632246     10.0.0.1 -> 10.0.0.2     TCP 54 0 → 38 [RST, ACK] Seq=1 Ack=1 Win=0 Len=0
 83 39.003680772     10.0.0.2 -> 10.0.0.1     TCP 54 39 → 0 [<None>] Seq=1 Win=512 Len=0
 84 39.003700053     10.0.0.1 -> 10.0.0.2     TCP 54 0 → 39 [RST, ACK] Seq=1 Ack=1 Win=0 Len=0
 85 40.003804845     10.0.0.2 -> 10.0.0.1     TCP 54 40 → 0 [<None>] Seq=1 Win=512 Len=0
 86 40.003826951     10.0.0.1 -> 10.0.0.2     TCP 54 0 → 40 [RST, ACK] Seq=1 Ack=1 Win=0 Len=0
 87 41.003888219     10.0.0.2 -> 10.0.0.1     TCP 54 41 → 0 [<None>] Seq=1 Win=512 Len=0
 88 41.003901977     10.0.0.1 -> 10.0.0.2     TCP 54 0 → 41 [RST, ACK] Seq=1 Ack=1 Win=0 Len=0
 89 41.016227471 ce:09:ed:74:57:97 -> 62:82:d2:70:5e:37 ARP 42 Who has 10.0.0.1? Tell 10.0.0.2
 90 41.016269647 62:82:d2:70:5e:37 -> ce:09:ed:74:57:97 ARP 42 10.0.0.1 is at 62:82:d2:70:5e:37
 91 42.003979944     10.0.0.2 -> 10.0.0.1     TCP 54 42 → 0 [<None>] Seq=1 Win=512 Len=0
 92 42.003992985     10.0.0.1 -> 10.0.0.2     TCP 54 0 → 42 [RST, ACK] Seq=1 Ack=1 Win=0 Len=0
 93 43.004063212     10.0.0.2 -> 10.0.0.1     TCP 54 43 → 0 [<None>] Seq=1 Win=512 Len=0
 94 43.004077329     10.0.0.1 -> 10.0.0.2     TCP 54 0 → 43 [RST, ACK] Seq=1 Ack=1 Win=0 Len=0
 95 44.004190076     10.0.0.2 -> 10.0.0.1     TCP 54 44 → 0 [<None>] Seq=1 Win=512 Len=0
 96 44.004204112     10.0.0.1 -> 10.0.0.2     TCP 54 0 → 44 [RST, ACK] Seq=1 Ack=1 Win=0 Len=0
 97 45.004283160     10.0.0.2 -> 10.0.0.1     TCP 54 45 → 0 [<None>] Seq=1 Win=512 Len=0
 98 45.004296886     10.0.0.1 -> 10.0.0.2     TCP 54 0 → 45 [RST, ACK] Seq=1 Ack=1 Win=0 Len=0
 99 46.004367584     10.0.0.2 -> 10.0.0.1     TCP 54 46 → 0 [<None>] Seq=1 Win=512 Len=0
100 46.004381019     10.0.0.1 -> 10.0.0.2     TCP 54 0 → 46 [RST, ACK] Seq=1 Ack=1 Win=0 Len=0
101 47.004445986     10.0.0.2 -> 10.0.0.1     TCP 54 47 → 0 [<None>] Seq=1 Win=512 Len=0
102 47.004459481     10.0.0.1 -> 10.0.0.2     TCP 54 0 → 47 [RST, ACK] Seq=1 Ack=1 Win=0 Len=0
103 48.004563627     10.0.0.2 -> 10.0.0.1     TCP 54 48 → 0 [<None>] Seq=1 Win=512 Len=0
104 48.004578417     10.0.0.1 -> 10.0.0.2     TCP 54 0 → 48 [RST, ACK] Seq=1 Ack=1 Win=0 Len=0
105 49.004648196     10.0.0.2 -> 10.0.0.1     TCP 54 49 → 0 [<None>] Seq=1 Win=512 Len=0
106 49.004662624     10.0.0.1 -> 10.0.0.2     TCP 54 0 → 49 [RST, ACK] Seq=1 Ack=1 Win=0 Len=0
107 50.004733493     10.0.0.2 -> 10.0.0.1     TCP 54 50 → 0 [<None>] Seq=1 Win=512 Len=0
108 50.004747672     10.0.0.1 -> 10.0.0.2     TCP 54 0 → 50 [RST, ACK] Seq=1 Ack=1 Win=0 Len=0
109 50.007782284 62:82:d2:70:5e:37 -> ce:09:ed:74:57:97 ARP 42 Who has 10.0.0.2? Tell 10.0.0.1
110 50.007825019 ce:09:ed:74:57:97 -> 62:82:d2:70:5e:37 ARP 42 10.0.0.2 is at ce:09:ed:74:57:97
111 51.004822128     10.0.0.2 -> 10.0.0.1     TCP 54 51 → 0 [<None>] Seq=1 Win=512 Len=0
112 51.004835230     10.0.0.1 -> 10.0.0.2     TCP 54 0 → 51 [RST, ACK] Seq=1 Ack=1 Win=0 Len=0
113 52.004912530     10.0.0.2 -> 10.0.0.1     TCP 54 52 → 0 [<None>] Seq=1 Win=512 Len=0
114 52.004924925     10.0.0.1 -> 10.0.0.2     TCP 54 0 → 52 [RST, ACK] Seq=1 Ack=1 Win=0 Len=0
115 53.005029953     10.0.0.2 -> 10.0.0.1     TCP 54 53 → 0 [<None>] Seq=1 Win=512 Len=0
116 53.005044237     10.0.0.1 -> 10.0.0.2     TCP 54 0 → 53 [RST, ACK] Seq=1 Ack=1 Win=0 Len=0
117 54.005152227     10.0.0.2 -> 10.0.0.1     TCP 54 54 → 0 [<None>] Seq=1 Win=512 Len=0
118 54.005166256     10.0.0.1 -> 10.0.0.2     TCP 54 0 → 54 [RST, ACK] Seq=1 Ack=1 Win=0 Len=0
119 55.005238802     10.0.0.2 -> 10.0.0.1     TCP 54 55 → 0 [<None>] Seq=1 Win=512 Len=0
120 55.005253723     10.0.0.1 -> 10.0.0.2     TCP 54 0 → 55 [RST, ACK] Seq=1 Ack=1 Win=0 Len=0
121 56.005342898     10.0.0.2 -> 10.0.0.1     TCP 54 56 → 0 [<None>] Seq=1 Win=512 Len=0
122 56.005357525     10.0.0.1 -> 10.0.0.2     TCP 54 0 → 56 [RST, ACK] Seq=1 Ack=1 Win=0 Len=0
123 57.005472836     10.0.0.2 -> 10.0.0.1     TCP 54 57 → 0 [<None>] Seq=1 Win=512 Len=0
124 57.005493135     10.0.0.1 -> 10.0.0.2     TCP 54 0 → 57 [RST, ACK] Seq=1 Ack=1 Win=0 Len=0
125 58.005568642     10.0.0.2 -> 10.0.0.1     TCP 54 58 → 0 [<None>] Seq=1 Win=512 Len=0
126 58.005582783     10.0.0.1 -> 10.0.0.2     TCP 54 0 → 58 [RST, ACK] Seq=1 Ack=1 Win=0 Len=0
127 59.005641447     10.0.0.2 -> 10.0.0.1     TCP 54 59 → 0 [<None>] Seq=1 Win=512 Len=0
128 59.005654459     10.0.0.1 -> 10.0.0.2     TCP 54 0 → 59 [RST, ACK] Seq=1 Ack=1 Win=0 Len=0
129 60.005760666     10.0.0.2 -> 10.0.0.1     TCP 54 60 → 0 [<None>] Seq=1 Win=512 Len=0
130 60.005775918     10.0.0.1 -> 10.0.0.2     TCP 54 0 → 60 [RST, ACK] Seq=1 Ack=1 Win=0 Len=0
131 61.005885729     10.0.0.2 -> 10.0.0.1     TCP 54 61 → 0 [<None>] Seq=1 Win=512 Len=0
132 61.00